{
  "$schema": "https://json-schema.org/draft/2020-12/schema",
  "$id": "https://hellorealworld.dev/contracts/schemas/time-series.schema.json",
  "title": "Benchmark compact time series",
  "$defs": {
    "metricValue": { "type": ["number", "null"], "minimum": 0 },
    "ratioValue": { "type": ["number", "null"], "minimum": 0, "maximum": 1 }
  },
  "type": "object",
  "additionalProperties": false,
  "required": ["schema_version", "trial_id", "sample_interval_ms", "samples"],
  "properties": {
    "schema_version": { "const": "1.0" },
    "trial_id": { "type": "string", "minLength": 1 },
    "sample_interval_ms": { "type": "integer", "minimum": 1 },
    "samples": {
      "type": "array",
      "items": {
        "type": "object",
        "additionalProperties": false,
        "required": [
          "elapsed_ms",
          "target_cpu_percent",
          "target_memory_bytes",
          "target_memory_percent"
        ],
        "dependentRequired": {
          "requested_rps": [
            "achieved_rps",
            "request_count",
            "failure_count",
            "error_rate",
            "p50_ms",
            "p95_ms",
            "p99_ms"
          ]
        },
        "properties": {
          "elapsed_ms": { "type": "integer", "minimum": 0 },
          "target_cpu_percent": { "$ref": "#/$defs/metricValue" },
          "target_memory_bytes": { "type": ["integer", "null"], "minimum": 0 },
          "target_memory_percent": { "$ref": "#/$defs/metricValue" },
          "source_time": { "type": "string", "format": "date-time" },
          "load_generator_cpu_percent": { "$ref": "#/$defs/metricValue" },
          "load_generator_memory_bytes": { "type": ["integer", "null"], "minimum": 0 },
          "dependency_cpu_percent": { "$ref": "#/$defs/metricValue" },
          "dependency_memory_bytes": { "type": ["integer", "null"], "minimum": 0 },
          "host_cpu_percent": { "$ref": "#/$defs/metricValue" },
          "host_memory_bytes": { "type": ["integer", "null"], "minimum": 0 },
          "background_cpu_millicores": { "$ref": "#/$defs/metricValue" },
          "background_memory_bytes": { "type": ["integer", "null"], "minimum": 0 },
          "requested_rps": { "$ref": "#/$defs/metricValue" },
          "achieved_rps": { "$ref": "#/$defs/metricValue" },
          "request_count": { "type": ["integer", "null"], "minimum": 0 },
          "failure_count": { "type": ["integer", "null"], "minimum": 0 },
          "error_rate": { "$ref": "#/$defs/ratioValue" },
          "p50_ms": { "$ref": "#/$defs/metricValue" },
          "p95_ms": { "$ref": "#/$defs/metricValue" },
          "p99_ms": { "$ref": "#/$defs/metricValue" }
        }
      }
    }
  }
}
