{
  "schema_version": "1.0",
  "trial_id": "trial-02",
  "sample_interval_ms": 10000,
  "samples": [
    {
      "elapsed_ms": 10000,
      "source_time": "2026-07-17T06:30:19Z",
      "target_cpu_percent": 7.9196,
      "target_memory_bytes": 326369280,
      "target_memory_percent": 30.3955,
      "load_generator_cpu_percent": 11.8387,
      "load_generator_memory_bytes": 76865536,
      "dependency_cpu_percent": 12.0717,
      "dependency_memory_bytes": 176918528,
      "host_cpu_percent": 71.3232,
      "host_memory_bytes": 2797666304,
      "background_cpu_millicores": 394.9318,
      "background_memory_bytes": 2217512960,
      "requested_rps": 200.0,
      "achieved_rps": 199.9,
      "request_count": 1999,
      "failure_count": 0,
      "error_rate": 0.0,
      "p50_ms": 3.032537,
      "p95_ms": 3.4494152,
      "p99_ms": 3.7564710999999997
    },
    {
      "elapsed_ms": 20000,
      "source_time": "2026-07-17T06:30:29Z",
      "target_cpu_percent": 13.9275,
      "target_memory_bytes": 330289152,
      "target_memory_percent": 30.7606,
      "load_generator_cpu_percent": 11.8387,
      "load_generator_memory_bytes": 76865536,
      "dependency_cpu_percent": 17.1183,
      "dependency_memory_bytes": 176975872,
      "host_cpu_percent": 73.9315,
      "host_memory_bytes": 2826596352,
      "background_cpu_millicores": 310.4689,
      "background_memory_bytes": 2242465792,
      "requested_rps": 200.0,
      "achieved_rps": 200.0,
      "request_count": 2000,
      "failure_count": 0,
      "error_rate": 0.0,
      "p50_ms": 3.0683825000000002,
      "p95_ms": 3.5477494999999997,
      "p99_ms": 3.78153127
    },
    {
      "elapsed_ms": 30000,
      "source_time": "2026-07-17T06:30:39Z",
      "target_cpu_percent": 13.9275,
      "target_memory_bytes": 330289152,
      "target_memory_percent": 30.7606,
      "load_generator_cpu_percent": 10.9667,
      "load_generator_memory_bytes": 86360064,
      "dependency_cpu_percent": 17.1183,
      "dependency_memory_bytes": 176975872,
      "host_cpu_percent": 76.6334,
      "host_memory_bytes": 2803355648,
      "background_cpu_millicores": 346.2084,
      "background_memory_bytes": 2209730560,
      "requested_rps": 200.0,
      "achieved_rps": 200.0,
      "request_count": 2000,
      "failure_count": 0,
      "error_rate": 0.0,
      "p50_ms": 2.9732605,
      "p95_ms": 3.396827,
      "p99_ms": 3.6410882
    },
    {
      "elapsed_ms": 40000,
      "source_time": "2026-07-17T06:30:49Z",
      "target_cpu_percent": 13.6778,
      "target_memory_bytes": 330297344,
      "target_memory_percent": 30.7613,
      "load_generator_cpu_percent": 10.5921,
      "load_generator_memory_bytes": 86863872,
      "dependency_cpu_percent": 17.026,
      "dependency_memory_bytes": 177303552,
      "host_cpu_percent": 71.1469,
      "host_memory_bytes": 2805850112,
      "background_cpu_millicores": 298.5101,
      "background_memory_bytes": 2211385344,
      "requested_rps": 200.0,
      "achieved_rps": 200.0,
      "request_count": 2000,
      "failure_count": 0,
      "error_rate": 0.0,
      "p50_ms": 3.042026,
      "p95_ms": 3.45876115,
      "p99_ms": 3.7563509899999996
    },
    {
      "elapsed_ms": 50000,
      "source_time": "2026-07-17T06:30:59Z",
      "target_cpu_percent": 13.6033,
      "target_memory_bytes": 330051584,
      "target_memory_percent": 30.7384,
      "load_generator_cpu_percent": 10.5921,
      "load_generator_memory_bytes": 86863872,
      "dependency_cpu_percent": 17.7392,
      "dependency_memory_bytes": 177205248,
      "host_cpu_percent": 73.9343,
      "host_memory_bytes": 2810744832,
      "background_cpu_millicores": 319.9979,
      "background_memory_bytes": 2216624128,
      "requested_rps": 200.0,
      "achieved_rps": 200.0,
      "request_count": 2000,
      "failure_count": 0,
      "error_rate": 0.0,
      "p50_ms": 3.0538939999999997,
      "p95_ms": 3.4928082,
      "p99_ms": 3.6965853099999997
    },
    {
      "elapsed_ms": 60000,
      "source_time": "2026-07-17T06:31:09Z",
      "target_cpu_percent": 13.6033,
      "target_memory_bytes": 330051584,
      "target_memory_percent": 30.7384,
      "load_generator_cpu_percent": 10.706,
      "load_generator_memory_bytes": 88100864,
      "dependency_cpu_percent": 17.7392,
      "dependency_memory_bytes": 177205248,
      "host_cpu_percent": 72.206,
      "host_memory_bytes": 2806751232,
      "background_cpu_millicores": 301.5758,
      "background_memory_bytes": 2211393536,
      "requested_rps": 200.0,
      "achieved_rps": 200.0,
      "request_count": 2000,
      "failure_count": 0,
      "error_rate": 0.0,
      "p50_ms": 3.0311395,
      "p95_ms": 3.4801479,
      "p99_ms": 3.75052817
    },
    {
      "elapsed_ms": 70000,
      "source_time": "2026-07-17T06:31:19Z",
      "target_cpu_percent": 13.5107,
      "target_memory_bytes": 330620928,
      "target_memory_percent": 30.7915,
      "load_generator_cpu_percent": 10.7168,
      "load_generator_memory_bytes": 88793088,
      "dependency_cpu_percent": 17.005,
      "dependency_memory_bytes": 177217536,
      "host_cpu_percent": 73.4283,
      "host_memory_bytes": 2807652352,
      "background_cpu_millicores": 321.9582,
      "background_memory_bytes": 2211020800,
      "requested_rps": 200.0,
      "achieved_rps": 200.0,
      "request_count": 2000,
      "failure_count": 0,
      "error_rate": 0.0,
      "p50_ms": 3.0092815,
      "p95_ms": 3.3974937,
      "p99_ms": 3.64989193
    },
    {
      "elapsed_ms": 80000,
      "source_time": "2026-07-17T06:31:29Z",
      "target_cpu_percent": 13.5107,
      "target_memory_bytes": 330620928,
      "target_memory_percent": 30.7915,
      "load_generator_cpu_percent": 10.6474,
      "load_generator_memory_bytes": 89677824,
      "dependency_cpu_percent": 17.005,
      "dependency_memory_bytes": 177217536,
      "host_cpu_percent": 72.3817,
      "host_memory_bytes": 2830286848,
      "background_cpu_millicores": 312.1859,
      "background_memory_bytes": 2232770560,
      "requested_rps": 200.0,
      "achieved_rps": 200.0,
      "request_count": 2000,
      "failure_count": 0,
      "error_rate": 0.0,
      "p50_ms": 3.030999,
      "p95_ms": 3.4392160499999997,
      "p99_ms": 3.6746641099999997
    },
    {
      "elapsed_ms": 90000,
      "source_time": "2026-07-17T06:31:39Z",
      "target_cpu_percent": 13.5131,
      "target_memory_bytes": 330706944,
      "target_memory_percent": 30.7995,
      "load_generator_cpu_percent": 10.6474,
      "load_generator_memory_bytes": 89677824,
      "dependency_cpu_percent": 17.3108,
      "dependency_memory_bytes": 177311744,
      "host_cpu_percent": 72.3325,
      "host_memory_bytes": 2809704448,
      "background_cpu_millicores": 308.6116,
      "background_memory_bytes": 2212007936,
      "requested_rps": 200.0,
      "achieved_rps": 200.0,
      "request_count": 2000,
      "failure_count": 0,
      "error_rate": 0.0,
      "p50_ms": 3.0668745,
      "p95_ms": 3.5133244,
      "p99_ms": 3.72299303
    },
    {
      "elapsed_ms": 100000,
      "source_time": "2026-07-17T06:31:49Z",
      "target_cpu_percent": 13.5173,
      "target_memory_bytes": 330199040,
      "target_memory_percent": 30.7522,
      "load_generator_cpu_percent": 10.5968,
      "load_generator_memory_bytes": 89845760,
      "dependency_cpu_percent": 16.896,
      "dependency_memory_bytes": 177348608,
      "host_cpu_percent": 73.0974,
      "host_memory_bytes": 2813243392,
      "background_cpu_millicores": 320.8729,
      "background_memory_bytes": 2215849984,
      "requested_rps": 200.0,
      "achieved_rps": 200.0,
      "request_count": 2000,
      "failure_count": 0,
      "error_rate": 0.0,
      "p50_ms": 3.0012860000000003,
      "p95_ms": 3.482482,
      "p99_ms": 3.78000884
    },
    {
      "elapsed_ms": 110000,
      "source_time": "2026-07-17T06:31:59Z",
      "target_cpu_percent": 14.6192,
      "target_memory_bytes": 334135296,
      "target_memory_percent": 31.1188,
      "load_generator_cpu_percent": 11.1356,
      "load_generator_memory_bytes": 90832896,
      "dependency_cpu_percent": 16.896,
      "dependency_memory_bytes": 177348608,
      "host_cpu_percent": 77.0746,
      "host_memory_bytes": 2813759488,
      "background_cpu_millicores": 344.2379,
      "background_memory_bytes": 2211442688,
      "requested_rps": 200.0,
      "achieved_rps": 200.0,
      "request_count": 2000,
      "failure_count": 0,
      "error_rate": 0.0,
      "p50_ms": 3.038153,
      "p95_ms": 3.47370255,
      "p99_ms": 3.7582312
    },
    {
      "elapsed_ms": 120000,
      "source_time": "2026-07-17T06:32:09Z",
      "target_cpu_percent": 16.7935,
      "target_memory_bytes": 334012416,
      "target_memory_percent": 31.1073,
      "load_generator_cpu_percent": 11.1356,
      "load_generator_memory_bytes": 90832896,
      "dependency_cpu_percent": 18.5769,
      "dependency_memory_bytes": 177713152,
      "host_cpu_percent": 94.3633,
      "host_memory_bytes": 2814898176,
      "background_cpu_millicores": 478.5737,
      "background_memory_bytes": 2212339712,
      "requested_rps": 200.0,
      "achieved_rps": 200.0,
      "request_count": 2000,
      "failure_count": 0,
      "error_rate": 0.0,
      "p50_ms": 3.0198964999999998,
      "p95_ms": 3.4676636999999997,
      "p99_ms": 3.72744023
    },
    {
      "elapsed_ms": 130000,
      "source_time": "2026-07-17T06:32:19Z",
      "target_cpu_percent": 31.619,
      "target_memory_bytes": 334626816,
      "target_memory_percent": 31.1646,
      "load_generator_cpu_percent": 18.9394,
      "load_generator_memory_bytes": 93179904,
      "dependency_cpu_percent": 30.3378,
      "dependency_memory_bytes": 177549312,
      "host_cpu_percent": 116.6086,
      "host_memory_bytes": 2818002944,
      "background_cpu_millicores": 357.124,
      "background_memory_bytes": 2212646912,
      "requested_rps": 600.0,
      "achieved_rps": 599.8,
      "request_count": 5998,
      "failure_count": 0,